{
  "meta": {
    "title": "Tax rates: statutory and effective",
    "description": "Nominal (statutory) rates from the law texts, effective rates of the very wealthy from research, and the parameters the interactive calculator needs. Research figures are static with an as_of date.",
    "updated_at": "2026-09-26",
    "default_max_age_months": 18,
    "pipeline": "manual"
  },
  "nominal": {
    "DE": {
      "income_tax_top_rate": {
        "value": 45,
        "unit": "percent",
        "currency": null,
        "source": "§ 32a Abs. 1 EStG (Tarif 2026)",
        "source_url": "https://www.gesetze-im-internet.de/estg/__32a.html",
        "retrieved_at": "2026-09-26",
        "as_of": "2026",
        "definition": "Top marginal income tax rate ('Reichensteuer') on taxable income above 277 825 € (single), before the 5.5 % solidarity surcharge.",
        "is_estimate": false,
        "auto": false
      },
      "income_tax_top_threshold": {
        "value": 277826,
        "unit": "currency",
        "currency": "EUR",
        "source": "§ 32a Abs. 1 Nr. 5 EStG (Tarif 2026)",
        "source_url": "https://www.gesetze-im-internet.de/estg/__32a.html",
        "retrieved_at": "2026-09-26",
        "as_of": "2026",
        "definition": "Taxable income (single) from which the 45 % rate applies in 2026.",
        "is_estimate": false,
        "auto": false
      },
      "income_tax_42_threshold": {
        "value": 69879,
        "unit": "currency",
        "currency": "EUR",
        "source": "§ 32a Abs. 1 Nr. 4 EStG (Tarif 2026)",
        "source_url": "https://www.gesetze-im-internet.de/estg/__32a.html",
        "retrieved_at": "2026-09-26",
        "as_of": "2026",
        "definition": "Taxable income (single) from which the 42 % marginal rate applies in 2026.",
        "is_estimate": false,
        "auto": false
      },
      "solidarity_surcharge": {
        "value": 5.5,
        "unit": "percent",
        "currency": null,
        "source": "§ 4 SolzG 1995; exemption threshold § 3 SolzG (20 350 € income tax for singles in 2026)",
        "source_url": "https://www.gesetze-im-internet.de/solzg_1995/__4.html",
        "retrieved_at": "2026-09-26",
        "as_of": "2026",
        "definition": "Solidarity surcharge as a percentage of the income or corporate tax. Since 2021 it is only levied on high incomes: for singles once the income tax exceeds 20 350 € (2026), with a sliding zone above that.",
        "is_estimate": false,
        "auto": false
      },
      "capital_income_flat_rate": {
        "value": 25,
        "unit": "percent",
        "currency": null,
        "source": "§ 32d Abs. 1 EStG (Abgeltungsteuer)",
        "source_url": "https://www.gesetze-im-internet.de/estg/__32d.html",
        "retrieved_at": "2026-09-26",
        "as_of": "2026",
        "definition": "Flat withholding tax on private capital income (interest, dividends, realised gains on shares), plus 5.5 % solidarity surcharge on the tax = 26.375 % in total. Unrealised gains are not taxed.",
        "is_estimate": false,
        "auto": false
      },
      "corporate_income_tax": {
        "value": 15,
        "unit": "percent",
        "currency": null,
        "source": "§ 23 Abs. 1 KStG; reduction to 10 % in five steps from 2028 to 2032 enacted by the Gesetz für ein steuerliches Investitionssofortprogramm (Bundesrat, 11 July 2025)",
        "source_url": "https://www.gesetze-im-internet.de/kstg_1977/__23.html",
        "retrieved_at": "2026-09-26",
        "as_of": "2026",
        "definition": "Corporate income tax rate on retained and distributed profits of corporations (plus 5.5 % solidarity surcharge = 15.825 %). Falls by one point per year from 2028 to 10 % in 2032.",
        "is_estimate": false,
        "auto": false,
        "notes": "Law change: https://www.bundestag.de/dokumente/textarchiv/2025/kw26-de-investitionssofortprogramm-1084772"
      },
      "trade_tax_average": {
        "value": 14.3,
        "unit": "percent",
        "currency": null,
        "source": "Statistisches Bundesamt (Destatis), Pressemitteilung Nr. 309 vom 21. August 2025: durchschnittlicher Gewerbesteuer-Hebesatz 2024 409 %; Messzahl 3,5 % nach § 11 GewStG",
        "source_url": "https://www.destatis.de/DE/Presse/Pressemitteilungen/2025/08/PD25_309_713.html",
        "retrieved_at": "2026-09-26",
        "as_of": "2024",
        "definition": "Effective municipal trade tax rate at the 2024 nationwide average multiplier: 3.5 % × 409 % ≈ 14.3 % of trade income. Together with corporate tax and surcharge, corporations pay about 30 % on profits.",
        "is_estimate": false,
        "derived": {
          "formula": "3.5 % × 409 %",
          "inputs": []
        },
        "auto": false,
        "max_age_months": 24,
        "refresh_hint": "Destatis Realsteuervergleich / Gewerbesteuer press release each August."
      },
      "inheritance_tax_class1_range": {
        "value": 30,
        "unit": "percent",
        "currency": null,
        "source": "§ 19 ErbStG (tax rates), § 16 ErbStG (personal allowances), §§ 13a, 13b ErbStG (business-asset relief)",
        "source_url": "https://www.gesetze-im-internet.de/erbstg_1974/__19.html",
        "retrieved_at": "2026-09-26",
        "as_of": "2026",
        "definition": "Top rate of inheritance and gift tax for tax class I (spouse, children) — the scale runs from 7 % to 30 % depending on the taxable amount; class III (unrelated) 30–50 %. Children have a 400 000 € allowance per parent. Business assets can be 85 % or 100 % exempt under §§ 13a/13b ErbStG if the business is continued and payroll conditions are met.",
        "is_estimate": false,
        "auto": false
      },
      "wealth_tax": {
        "value": 0,
        "unit": "percent",
        "currency": null,
        "source": "Bundesverfassungsgericht, Beschluss vom 22. Juni 1995 – 2 BvL 37/91; Vermögensteuer nicht mehr erhoben seit 1. Januar 1997 (Wikipedia: Vermögensteuer (Deutschland))",
        "source_url": "https://de.wikipedia.org/wiki/Verm%C3%B6gensteuer_(Deutschland)",
        "retrieved_at": "2026-09-26",
        "as_of": "2026",
        "definition": "Germany's wealth tax has not been levied since 1997. The Constitutional Court found the unequal valuation of real estate versus other assets unconstitutional and set a deadline for reform (end of 1996) which the legislature let pass. The law formally still exists.",
        "is_estimate": false,
        "auto": false
      },
      "exit_tax": {
        "value": 100,
        "unit": "percent",
        "currency": null,
        "source": "§ 6 AStG (Wegzugsbesteuerung)",
        "source_url": "https://www.gesetze-im-internet.de/astg/__6.html",
        "retrieved_at": "2026-09-26",
        "as_of": "2026",
        "definition": "Exit taxation: when a person who holds at least 1 % of a corporation moves abroad after at least 7 of the last 12 years of unlimited tax liability, the unrealised gain on those shares is treated as realised (fictitious sale) and taxed. The value 100 here means 'applies to 100 % of the fictitious gain'; the rate is the ordinary income tax rate under the partial-income method.",
        "is_estimate": false,
        "auto": false
      }
    },
    "US": {
      "income_tax_top_rate": {
        "value": 37,
        "unit": "percent",
        "currency": null,
        "source": "IRS, Revenue Procedure 2025-32 (tax year 2026 inflation adjustments); Tax Foundation summary",
        "source_url": "https://www.irs.gov/newsroom/irs-releases-tax-inflation-adjustments-for-tax-year-2026-including-amendments-from-the-one-big-beautiful-bill",
        "retrieved_at": "2026-09-26",
        "as_of": "2026",
        "definition": "Top federal marginal income tax rate, applying to taxable income above 640 600 USD (single) in 2026. State income taxes (0–13.3 %) come on top and are not included anywhere on this site.",
        "is_estimate": false,
        "auto": false
      },
      "capital_gains_top_rate": {
        "value": 20,
        "unit": "percent",
        "currency": null,
        "source": "IRS Topic No. 409 (capital gains and losses); 2026 thresholds per Rev. Proc. 2025-32",
        "source_url": "https://www.irs.gov/taxtopics/tc409",
        "retrieved_at": "2026-09-26",
        "as_of": "2026",
        "definition": "Top federal rate on long-term capital gains and qualified dividends (taxable income above 545 500 USD, single, 2026), plus the 3.8 % net investment income tax = 23.8 %. Unrealised gains are not taxed; at death the cost basis is stepped up.",
        "is_estimate": false,
        "auto": false
      },
      "corporate_income_tax": {
        "value": 21,
        "unit": "percent",
        "currency": null,
        "source": "IRS, Instructions for Form 1120 / 26 U.S.C. § 11 (flat 21 % since the Tax Cuts and Jobs Act 2017)",
        "source_url": "https://www.irs.gov/businesses/small-businesses-self-employed/estate-tax",
        "retrieved_at": "2026-09-26",
        "as_of": "2026",
        "definition": "Federal corporate income tax rate. State corporate taxes (0–about 10 %) come on top.",
        "is_estimate": false,
        "auto": false,
        "notes": "source_url points to the IRS business-tax section; the statutory rate is 26 U.S.C. § 11(b)."
      },
      "estate_tax_top_rate": {
        "value": 40,
        "unit": "percent",
        "currency": null,
        "source": "IRS, Estate Tax; basic exclusion amount 15 000 000 USD per person from 2026 (Rev. Proc. 2025-32)",
        "source_url": "https://www.irs.gov/businesses/small-businesses-self-employed/estate-tax",
        "retrieved_at": "2026-09-26",
        "as_of": "2026",
        "definition": "Top federal estate and gift tax rate on the value of an estate above the exclusion amount of 15 million USD per person (30 million per couple) in 2026.",
        "is_estimate": false,
        "auto": false
      },
      "wealth_tax": {
        "value": 0,
        "unit": "percent",